{
  "fixtureKind": "development-mock-text-content",
  "gameId": "cards-money-trains-mock",
  "locale": "ru-RU",
  "warning": "MOCK: весь текст вымышлен для технической проверки и не является содержанием автора игры.",
  "controlMetadata": {
    "contentRevision": 1,
    "sourceKind": "synthetic-test",
    "normativeUseAllowed": false,
    "authorApprovalRequired": true
  },
  "newsCards": [
    {
      "id": "mock-news-block-c-d",
      "title": "Ремонт на линии C–D",
      "summary": "MOCK: дорога C–D временно закрыта",
      "facilitatorNote": "Попросите команды назвать, какие договоренности затронет закрытие дороги.",
      "effect": { "kind": "edge-state", "edgeId": "mock-edge-c-d", "state": "blocked" }
    },
    {
      "id": "mock-news-open-c-d",
      "title": "Линия C–D снова открыта",
      "summary": "MOCK: дорога C–D снова открыта",
      "facilitatorNote": "Уточните, готовы ли команды вернуться к первоначальному маршруту или сохранят новый.",
      "effect": { "kind": "edge-state", "edgeId": "mock-edge-c-d", "state": "open" }
    },
    {
      "id": "mock-news-costly-service",
      "title": "Стоимость хранения",
      "summary": "MOCK: команды обсуждают стоимость удержания груза",
      "facilitatorNote": "Сравните цену ожидания с риском немедленной отправки.",
      "effect": { "kind": "methodical-prompt", "promptId": "mock-prompt-held-cargo" }
    },
    {
      "id": "mock-news-cheap-wagons",
      "title": "Скидка на вагоны",
      "summary": "MOCK: тестовая цена покупки вагона снижена",
      "facilitatorNote": "Попросите команды объяснить, меняет ли временная скидка их долгосрочный план.",
      "effect": { "kind": "market-price", "vehicleKind": "wagon", "purchase": 4 }
    },
    {
      "id": "mock-news-construction-window",
      "title": "Окно для совместного строительства",
      "summary": "MOCK: обсуждение совместного строительства обязательно перед ходом",
      "facilitatorNote": "Дайте сторонам договориться о вкладах до перехода к строительству.",
      "effect": { "kind": "methodical-prompt", "promptId": "mock-prompt-investment" }
    },
    {
      "id": "mock-news-stable-day",
      "title": "Стабильный день",
      "summary": "MOCK: сеть работает без дополнительных изменений",
      "facilitatorNote": "Используйте отсутствие внешнего события, чтобы обсудить инициативу самих команд.",
      "effect": { "kind": "none" }
    }
  ],
  "cargoCards": [
    { "id": "mock-cargo-b-c", "title": "Детали B–C", "briefing": "MOCK: срочная короткая перевозка деталей.", "fromNodeId": "mock-terminal-b", "toNodeId": "mock-terminal-c", "payout": 9, "copies": 1 },
    { "id": "mock-cargo-a-d", "title": "Оборудование A–D", "briefing": "MOCK: доставка учебного оборудования.", "fromNodeId": "mock-terminal-a", "toNodeId": "mock-terminal-d", "payout": 9, "copies": 1 },
    { "id": "mock-cargo-e-c", "title": "Материалы E–C", "briefing": "MOCK: небольшая партия материалов.", "fromNodeId": "mock-terminal-e", "toNodeId": "mock-terminal-c", "payout": 6, "copies": 1 },
    { "id": "mock-cargo-b-f", "title": "Комплект B–F", "briefing": "MOCK: дорогая перевозка через несколько участков сети.", "fromNodeId": "mock-terminal-b", "toNodeId": "mock-terminal-f", "payout": 30, "copies": 1 },
    { "id": "mock-cargo-a-e", "title": "Запчасти A–E", "briefing": "MOCK: стандартная партия запасных частей.", "fromNodeId": "mock-terminal-a", "toNodeId": "mock-terminal-e", "payout": 8, "copies": 1 },
    { "id": "mock-cargo-d-b", "title": "Инструменты D–B", "briefing": "MOCK: возвратная перевозка инструментов.", "fromNodeId": "mock-terminal-d", "toNodeId": "mock-terminal-b", "payout": 8, "copies": 1 },
    { "id": "mock-cargo-f-a", "title": "Модули F–A", "briefing": "MOCK: длинная перевозка сборочных модулей.", "fromNodeId": "mock-terminal-f", "toNodeId": "mock-terminal-a", "payout": 10, "copies": 1 },
    { "id": "mock-cargo-c-e", "title": "Образцы C–E", "briefing": "MOCK: перевозка контрольных образцов.", "fromNodeId": "mock-terminal-c", "toNodeId": "mock-terminal-e", "payout": 7, "copies": 1 },
    { "id": "mock-cargo-e-d", "title": "Контейнер E–D", "briefing": "MOCK: доставка универсального контейнера.", "fromNodeId": "mock-terminal-e", "toNodeId": "mock-terminal-d", "payout": 9, "copies": 1 },
    { "id": "mock-cargo-b-a", "title": "Документы B–A", "briefing": "MOCK: короткая перевозка архивных материалов.", "fromNodeId": "mock-terminal-b", "toNodeId": "mock-terminal-a", "payout": 5, "copies": 1 },
    { "id": "mock-cargo-c-f", "title": "Приборы C–F", "briefing": "MOCK: партия измерительных приборов.", "fromNodeId": "mock-terminal-c", "toNodeId": "mock-terminal-f", "payout": 6, "copies": 1 },
    { "id": "mock-cargo-f-d", "title": "Комплектующие F–D", "briefing": "MOCK: заключительная тестовая партия комплектующих.", "fromNodeId": "mock-terminal-f", "toNodeId": "mock-terminal-d", "payout": 8, "copies": 1 }
  ],
  "methodicalPauses": [
    {
      "id": "mock-pause-after-turn-3",
      "title": "Сверка ожиданий",
      "afterTurn": 3,
      "prompt": "Какие наблюдаемые изменения произошли, чего команды ожидали и что сообщили партнерам?",
      "facilitatorGoal": "Разделить наблюдаемые факты, предположения и коммуникацию между командами."
    },
    {
      "id": "mock-pause-after-turn-5",
      "title": "Стратегии партнеров",
      "afterTurn": 5,
      "prompt": "Как собственная стратегия соотносится со стратегиями партнеров и будущим результатом?",
      "facilitatorGoal": "Помочь участникам увидеть взаимозависимость решений перевозчиков и гильдий."
    },
    {
      "id": "mock-final-reflection",
      "title": "Перенос в практику",
      "afterPhase": "finished",
      "prompt": "Какие игровые решения похожи на реальные рабочие ситуации и что участники перенесут в практику?",
      "facilitatorGoal": "Зафиксировать один конкретный вывод и одно проверяемое действие после игры."
    }
  ],
  "roles": [
    {
      "id": "mock-role-facilitator",
      "label": "Ведущий",
      "audience": "facilitator",
      "briefing": "Управляет этапами и подтверждает только решения, уже озвученные участниками.",
      "responsibilities": ["Следить за текущим этапом.", "Проговаривать последствия действия до подтверждения.", "Проводить методические паузы без подсказки оптимальной стратегии."]
    },
    {
      "id": "mock-role-logistics-company",
      "label": "Команда перевозчиков",
      "audience": "logistics_company",
      "briefing": "Управляет вагонами, грузами и денежным результатом перевозок.",
      "responsibilities": ["Выбирать грузы и маршруты.", "Согласовывать тягу с паровозной гильдией.", "Сравнивать выплату, тариф и риск задержки."]
    },
    {
      "id": "mock-role-locomotive-guild",
      "label": "Паровозная гильдия",
      "audience": "locomotive_guild",
      "briefing": "Управляет локомотивами и договаривается об условиях перевозок.",
      "responsibilities": ["Распределять единицы действия локомотивов.", "Согласовывать сцепку и маршрут.", "Оценивать вклад в строительство сети."]
    }
  ],
  "instructions": {
    "facilitator": [
      {
        "id": "mock-instruction-facilitator-session",
        "title": "Проведение тестовой сессии",
        "body": "Перед началом напомните, что все названия, цены и тексты являются тестовыми. На каждом этапе сначала получите решение команды, затем выполните соответствующее действие на общем экране."
      }
    ],
    "participants": [
      {
        "id": "mock-instruction-participants-turn",
        "title": "Как принимать решение",
        "body": "Называйте цель, доступные ресурсы, ожидаемый результат и договоренности с другой стороной до того, как ведущий подтвердит действие."
      }
    ]
  }
}
